[
  {
    "id": "syn-fik-bm-000001",
    "source": "synthetic",
    "category": "Fiksyen",
    "language": "bm",
    "title": "Kisah Sang Tupai",
    "author": "Aina Farhana",
    "publisher": "Pelangi",
    "year": 2018,
    "pages": 24,
    "isbn": "9787000000018",
    "isbn_type": "synthetic",
    "rumusan": "Seekor tupai kecil belajar berkongsi makanan dengan rakan-rakannya di hutan.",
    "lesson": "Kita perlu berkongsi dan membantu kawan yang memerlukan.",
    "quality": "high",
    "created": "2026-07-01",
    "version": "1.0"
  },
  {
    "id": "syn-fik-bm-000002",
    "source": "synthetic",
    "category": "Fiksyen",
    "language": "bm",
    "title": "Burung Kecil Yang Berani",
    "author": "Nur Hafizah",
    "publisher": "Sasbadi",
    "year": 2020,
    "pages": 28,
    "isbn": "9787000000025",
    "isbn_type": "synthetic",
    "rumusan": "Seekor burung kecil berani menolong anak haiwan lain ketika hujan lebat.",
    "lesson": "Keberanian yang baik ialah berani membuat perkara yang betul.",
    "quality": "high",
    "created": "2026-07-01",
    "version": "1.0"
  },
  {
    "id": "syn-fik-bm-000003",
    "source": "synthetic",
    "category": "Fiksyen",
    "language": "bm",
    "title": "Hadiah Untuk Ibu",
    "author": "Siti Maisarah",
    "publisher": "Pelangi",
    "year": 2016,
    "pages": 20,
    "isbn": "9787000000032",
    "isbn_type": "synthetic",
    "rumusan": "Seorang kanak-kanak menyediakan hadiah ringkas untuk menghargai ibunya.",
    "lesson": "Kasih sayang boleh ditunjukkan melalui usaha kecil yang ikhlas.",
    "quality": "high",
    "created": "2026-07-01",
    "version": "1.0"
  },
  {
    "id": "syn-fik-bm-000004",
    "source": "synthetic",
    "category": "Fiksyen",
    "language": "bm",
    "title": "Aman dan Layang-layang",
    "author": "Zulhilmi Ahmad",
    "publisher": "Cerdik Publications",
    "year": 2022,
    "pages": 32,
    "isbn": "9787000000049",
    "isbn_type": "synthetic",
    "rumusan": "Aman belajar bersabar apabila layang-layangnya rosak sebelum pertandingan.",
    "lesson": "Sabar dan usaha membantu kita menyelesaikan masalah.",
    "quality": "high",
    "created": "2026-07-01",
    "version": "1.0"
  },
  {
    "id": "syn-fik-en-000009",
    "source": "synthetic",
    "category": "Fiksyen",
    "language": "en",
    "title": "The Helpful Bird",
    "author": "Emily Carter",
    "publisher": "Ladybird",
    "year": 2018,
    "pages": 24,
    "isbn": "9787000000094",
    "isbn_type": "synthetic",
    "rumusan": "A small bird helps lost animals find their way home before sunset.",
    "lesson": "Helping others can make a community safer and kinder.",
    "quality": "high",
    "created": "2026-07-01",
    "version": "1.0"
  },
  {
    "id": "syn-fik-en-000010",
    "source": "synthetic",
    "category": "Fiksyen",
    "language": "en",
    "title": "Mina and the Red Kite",
    "author": "Sarah Collins",
    "publisher": "Oxford",
    "year": 2020,
    "pages": 28,
    "isbn": "9787000000100",
    "isbn_type": "synthetic",
    "rumusan": "Mina fixes her kite with patience and shares it with her friends.",
    "lesson": "Patience and sharing can turn a problem into a happy day.",
    "quality": "high",
    "created": "2026-07-01",
    "version": "1.0"
  },
  {
    "id": "syn-fik-en-000011",
    "source": "synthetic",
    "category": "Fiksyen",
    "language": "en",
    "title": "The Little Raincoat",
    "author": "Anna Brooks",
    "publisher": "Scholastic",
    "year": 2017,
    "pages": 20,
    "isbn": "9787000000117",
    "isbn_type": "synthetic",
    "rumusan": "A child learns to be prepared when dark clouds appear before school.",
    "lesson": "Good preparation helps us face changes calmly.",
    "quality": "high",
    "created": "2026-07-01",
    "version": "1.0"
  },
  {
    "id": "syn-fik-en-000012",
    "source": "synthetic",
    "category": "Fiksyen",
    "language": "en",
    "title": "Tom's Garden Surprise",
    "author": "Michael Reed",
    "publisher": "Ladybird",
    "year": 2022,
    "pages": 32,
    "isbn": "9787000000124",
    "isbn_type": "synthetic",
    "rumusan": "Tom discovers that caring for plants takes time and responsibility.",
    "lesson": "Living things grow well when we care for them every day.",
    "quality": "high",
    "created": "2026-07-01",
    "version": "1.0"
  },
  {
    "id": "syn-fik-zh-000017",
    "source": "synthetic",
    "category": "Fiksyen",
    "language": "zh",
    "title": "小熊学礼貌",
    "author": "林小慧",
    "publisher": "明天出版社",
    "year": 2018,
    "pages": 24,
    "isbn": "9787000000179",
    "isbn_type": "synthetic",
    "rumusan": "小熊在学校和朋友相处时，慢慢学会说谢谢和对不起。",
    "lesson": "有礼貌能让人与人之间相处得更愉快。",
    "quality": "high",
    "created": "2026-07-01",
    "version": "1.0"
  },
  {
    "id": "syn-fik-zh-000018",
    "source": "synthetic",
    "category": "Fiksyen",
    "language": "zh",
    "title": "小鸭过马路",
    "author": "陈美玲",
    "publisher": "二十一世纪出版社",
    "year": 2020,
    "pages": 28,
    "isbn": "9787000000186",
    "isbn_type": "synthetic",
    "rumusan": "小鸭在妈妈的带领下学习看红绿灯，安全过马路。",
    "lesson": "遵守交通规则可以保护自己和别人。",
    "quality": "high",
    "created": "2026-07-01",
    "version": "1.0"
  },
  {
    "id": "syn-fik-zh-000019",
    "source": "synthetic",
    "category": "Fiksyen",
    "language": "zh",
    "title": "会分享的月饼",
    "author": "王丽萍",
    "publisher": "长江少年儿童出版社",
    "year": 2017,
    "pages": 20,
    "isbn": "9787000000193",
    "isbn_type": "synthetic",
    "rumusan": "中秋节时，小女孩把月饼分给邻居和朋友。",
    "lesson": "分享能带来快乐，也能拉近彼此的距离。",
    "quality": "high",
    "created": "2026-07-01",
    "version": "1.0"
  },
  {
    "id": "syn-fik-zh-000020",
    "source": "synthetic",
    "category": "Fiksyen",
    "language": "zh",
    "title": "勇敢的小种子",
    "author": "李安琪",
    "publisher": "明天出版社",
    "year": 2022,
    "pages": 32,
    "isbn": "9787000000209",
    "isbn_type": "synthetic",
    "rumusan": "一颗小种子经历风雨，最后长成美丽的小花。",
    "lesson": "遇到困难时坚持下去，就会慢慢成长。",
    "quality": "high",
    "created": "2026-07-01",
    "version": "1.0"
  }
]
