[
  {
    "id": "syn-bf-bm-000005",
    "source": "synthetic",
    "category": "Bukan Fiksyen",
    "language": "bm",
    "title": "Mari Kenal Cuaca",
    "author": "Dr. Farid Omar",
    "publisher": "Sasbadi",
    "year": 2019,
    "pages": 24,
    "isbn": "978-700-000-005-6",
    "isbn_type": "synthetic",
    "rumusan": "Buku ini menerangkan hujan, panas, angin dan awan dengan contoh mudah.",
    "lesson": "Memahami cuaca membantu kita merancang aktiviti harian.",
    "quality": "high",
    "created": "2026-07-01",
    "version": "1.0"
  },
  {
    "id": "syn-bf-bm-000006",
    "source": "synthetic",
    "category": "Bukan Fiksyen",
    "language": "bm",
    "title": "Haiwan Di Sekeliling Kita",
    "author": "Rohana Ali",
    "publisher": "Pelangi",
    "year": 2017,
    "pages": 28,
    "isbn": "978-700-000-006-3",
    "isbn_type": "synthetic",
    "rumusan": "Pembaca mengenali haiwan jinak dan liar serta tempat tinggalnya.",
    "lesson": "Kita perlu menyayangi haiwan dan menjaga alam sekitar.",
    "quality": "high",
    "created": "2026-07-01",
    "version": "1.0"
  },
  {
    "id": "syn-bf-bm-000007",
    "source": "synthetic",
    "category": "Bukan Fiksyen",
    "language": "bm",
    "title": "Jimat Air Setiap Hari",
    "author": "Nadia Rahim",
    "publisher": "Ilmu Bakti",
    "year": 2021,
    "pages": 20,
    "isbn": "978-700-000-007-0",
    "isbn_type": "synthetic",
    "rumusan": "Buku ini memberi cara mudah menjimatkan air di rumah dan sekolah.",
    "lesson": "Sumber air perlu dijaga kerana penting untuk semua hidupan.",
    "quality": "high",
    "created": "2026-07-01",
    "version": "1.0"
  },
  {
    "id": "syn-bf-bm-000008",
    "source": "synthetic",
    "category": "Bukan Fiksyen",
    "language": "bm",
    "title": "Makanan Sihat Untuk Saya",
    "author": "Azman Yusof",
    "publisher": "Cerdik Publications",
    "year": 2023,
    "pages": 24,
    "isbn": "978-700-000-008-7",
    "isbn_type": "synthetic",
    "rumusan": "Buku ini memperkenalkan kumpulan makanan dan kepentingan pemakanan seimbang.",
    "lesson": "Makanan sihat membantu badan kuat dan minda cerdas.",
    "quality": "high",
    "created": "2026-07-01",
    "version": "1.0"
  }
]
