[
  {
    "id": "syn-fik-zh-000017",
    "source": "synthetic",
    "category": "Fiksyen",
    "language": "zh",
    "title": "小熊学礼貌",
    "author": "林小慧",
    "publisher": "明天出版社",
    "year": 2018,
    "pages": 24,
    "isbn": "9787000000179",
    "isbn_type": "synthetic",
    "rumusan": "小熊在学校和朋友相处时，慢慢学会说谢谢和对不起。",
    "lesson": "有礼貌能让人与人之间相处得更愉快。",
    "quality": "high",
    "created": "2026-07-01",
    "version": "1.0"
  },
  {
    "id": "syn-fik-zh-000018",
    "source": "synthetic",
    "category": "Fiksyen",
    "language": "zh",
    "title": "小鸭过马路",
    "author": "陈美玲",
    "publisher": "二十一世纪出版社",
    "year": 2020,
    "pages": 28,
    "isbn": "9787000000186",
    "isbn_type": "synthetic",
    "rumusan": "小鸭在妈妈的带领下学习看红绿灯，安全过马路。",
    "lesson": "遵守交通规则可以保护自己和别人。",
    "quality": "high",
    "created": "2026-07-01",
    "version": "1.0"
  },
  {
    "id": "syn-fik-zh-000019",
    "source": "synthetic",
    "category": "Fiksyen",
    "language": "zh",
    "title": "会分享的月饼",
    "author": "王丽萍",
    "publisher": "长江少年儿童出版社",
    "year": 2017,
    "pages": 20,
    "isbn": "9787000000193",
    "isbn_type": "synthetic",
    "rumusan": "中秋节时，小女孩把月饼分给邻居和朋友。",
    "lesson": "分享能带来快乐，也能拉近彼此的距离。",
    "quality": "high",
    "created": "2026-07-01",
    "version": "1.0"
  },
  {
    "id": "syn-fik-zh-000020",
    "source": "synthetic",
    "category": "Fiksyen",
    "language": "zh",
    "title": "勇敢的小种子",
    "author": "李安琪",
    "publisher": "明天出版社",
    "year": 2022,
    "pages": 32,
    "isbn": "9787000000209",
    "isbn_type": "synthetic",
    "rumusan": "一颗小种子经历风雨，最后长成美丽的小花。",
    "lesson": "遇到困难时坚持下去，就会慢慢成长。",
    "quality": "high",
    "created": "2026-07-01",
    "version": "1.0"
  }
]
