[
  {
    "id": "syn-bf-bm-000005",
    "source": "synthetic",
    "category": "Bukan Fiksyen",
    "language": "bm",
    "title": "Mari Kenal Cuaca",
    "author": "Dr. Farid Omar",
    "publisher": "Sasbadi",
    "year": 2019,
    "pages": 24,
    "isbn": "978-700-000-005-6",
    "isbn_type": "synthetic",
    "rumusan": "Buku ini menerangkan hujan, panas, angin dan awan dengan contoh mudah.",
    "lesson": "Memahami cuaca membantu kita merancang aktiviti harian.",
    "quality": "high",
    "created": "2026-07-01",
    "version": "1.0"
  },
  {
    "id": "syn-bf-bm-000006",
    "source": "synthetic",
    "category": "Bukan Fiksyen",
    "language": "bm",
    "title": "Haiwan Di Sekeliling Kita",
    "author": "Rohana Ali",
    "publisher": "Pelangi",
    "year": 2017,
    "pages": 28,
    "isbn": "978-700-000-006-3",
    "isbn_type": "synthetic",
    "rumusan": "Pembaca mengenali haiwan jinak dan liar serta tempat tinggalnya.",
    "lesson": "Kita perlu menyayangi haiwan dan menjaga alam sekitar.",
    "quality": "high",
    "created": "2026-07-01",
    "version": "1.0"
  },
  {
    "id": "syn-bf-bm-000007",
    "source": "synthetic",
    "category": "Bukan Fiksyen",
    "language": "bm",
    "title": "Jimat Air Setiap Hari",
    "author": "Nadia Rahim",
    "publisher": "Ilmu Bakti",
    "year": 2021,
    "pages": 20,
    "isbn": "978-700-000-007-0",
    "isbn_type": "synthetic",
    "rumusan": "Buku ini memberi cara mudah menjimatkan air di rumah dan sekolah.",
    "lesson": "Sumber air perlu dijaga kerana penting untuk semua hidupan.",
    "quality": "high",
    "created": "2026-07-01",
    "version": "1.0"
  },
  {
    "id": "syn-bf-bm-000008",
    "source": "synthetic",
    "category": "Bukan Fiksyen",
    "language": "bm",
    "title": "Makanan Sihat Untuk Saya",
    "author": "Azman Yusof",
    "publisher": "Cerdik Publications",
    "year": 2023,
    "pages": 24,
    "isbn": "978-700-000-008-7",
    "isbn_type": "synthetic",
    "rumusan": "Buku ini memperkenalkan kumpulan makanan dan kepentingan pemakanan seimbang.",
    "lesson": "Makanan sihat membantu badan kuat dan minda cerdas.",
    "quality": "high",
    "created": "2026-07-01",
    "version": "1.0"
  },
  {
    "id": "syn-bf-en-000013",
    "source": "synthetic",
    "category": "Bukan Fiksyen",
    "language": "en",
    "title": "My First Book of Weather",
    "author": "Helen Ward",
    "publisher": "Oxford",
    "year": 2019,
    "pages": 24,
    "isbn": "978-700-000-013-1",
    "isbn_type": "synthetic",
    "rumusan": "This book explains sun, rain, wind and clouds using simple examples.",
    "lesson": "Learning about weather helps us make safe daily choices.",
    "quality": "high",
    "created": "2026-07-01",
    "version": "1.0"
  },
  {
    "id": "syn-bf-en-000014",
    "source": "synthetic",
    "category": "Bukan Fiksyen",
    "language": "en",
    "title": "Animals Around Us",
    "author": "Peter Grant",
    "publisher": "Scholastic",
    "year": 2016,
    "pages": 28,
    "isbn": "978-700-000-014-8",
    "isbn_type": "synthetic",
    "rumusan": "Readers learn about common animals, their homes and basic habits.",
    "lesson": "Animals should be treated with care and respect.",
    "quality": "high",
    "created": "2026-07-01",
    "version": "1.0"
  },
  {
    "id": "syn-bf-en-000015",
    "source": "synthetic",
    "category": "Bukan Fiksyen",
    "language": "en",
    "title": "Saving Water at Home",
    "author": "Laura Hill",
    "publisher": "Oxford",
    "year": 2021,
    "pages": 20,
    "isbn": "978-700-000-015-5",
    "isbn_type": "synthetic",
    "rumusan": "The book gives easy ways to avoid wasting water at home.",
    "lesson": "Small daily actions can protect important natural resources.",
    "quality": "high",
    "created": "2026-07-01",
    "version": "1.0"
  },
  {
    "id": "syn-bf-en-000016",
    "source": "synthetic",
    "category": "Bukan Fiksyen",
    "language": "en",
    "title": "Healthy Food for Kids",
    "author": "Rachel Green",
    "publisher": "Ladybird",
    "year": 2023,
    "pages": 24,
    "isbn": "978-700-000-016-2",
    "isbn_type": "synthetic",
    "rumusan": "Children learn about fruits, vegetables, grains and balanced meals.",
    "lesson": "Healthy food gives energy for learning and playing.",
    "quality": "high",
    "created": "2026-07-01",
    "version": "1.0"
  },
  {
    "id": "syn-bf-zh-000021",
    "source": "synthetic",
    "category": "Bukan Fiksyen",
    "language": "zh",
    "title": "认识天气",
    "author": "周明华",
    "publisher": "二十一世纪出版社",
    "year": 2019,
    "pages": 24,
    "isbn": "978-700-000-021-6",
    "isbn_type": "synthetic",
    "rumusan": "本书介绍晴天、雨天、刮风和云的变化。",
    "lesson": "认识天气能帮助我们安排生活和活动。",
    "quality": "high",
    "created": "2026-07-01",
    "version": "1.0"
  },
  {
    "id": "syn-bf-zh-000022",
    "source": "synthetic",
    "category": "Bukan Fiksyen",
    "language": "zh",
    "title": "身边的小动物",
    "author": "黄佳怡",
    "publisher": "长江少年儿童出版社",
    "year": 2016,
    "pages": 28,
    "isbn": "978-700-000-022-3",
    "isbn_type": "synthetic",
    "rumusan": "孩子通过图片和短文认识常见动物的特点。",
    "lesson": "爱护动物也是爱护我们的生活环境。",
    "quality": "high",
    "created": "2026-07-01",
    "version": "1.0"
  },
  {
    "id": "syn-bf-zh-000023",
    "source": "synthetic",
    "category": "Bukan Fiksyen",
    "language": "zh",
    "title": "节约用水",
    "author": "刘文杰",
    "publisher": "明天出版社",
    "year": 2021,
    "pages": 20,
    "isbn": "978-700-000-023-0",
    "isbn_type": "synthetic",
    "rumusan": "本书说明在家里和学校节约用水的方法。",
    "lesson": "水资源很珍贵，人人都应该珍惜。",
    "quality": "high",
    "created": "2026-07-01",
    "version": "1.0"
  },
  {
    "id": "syn-bf-zh-000024",
    "source": "synthetic",
    "category": "Bukan Fiksyen",
    "language": "zh",
    "title": "健康饮食小知识",
    "author": "张雅雯",
    "publisher": "二十一世纪出版社",
    "year": 2023,
    "pages": 24,
    "isbn": "978-700-000-024-7",
    "isbn_type": "synthetic",
    "rumusan": "孩子学习蔬菜、水果和均衡饮食的重要性。",
    "lesson": "健康饮食能让身体更强壮，学习更有精神。",
    "quality": "high",
    "created": "2026-07-01",
    "version": "1.0"
  }
]
