[
  {
    "id": "syn-bf-en-000013",
    "source": "synthetic",
    "category": "Bukan Fiksyen",
    "language": "en",
    "title": "My First Book of Weather",
    "author": "Helen Ward",
    "publisher": "Oxford",
    "year": 2019,
    "pages": 24,
    "isbn": "9787000000131",
    "isbn_type": "synthetic",
    "rumusan": "This book explains sun, rain, wind and clouds using simple examples.",
    "lesson": "Learning about weather helps us make safe daily choices.",
    "quality": "high",
    "created": "2026-07-01",
    "version": "1.0"
  },
  {
    "id": "syn-bf-en-000014",
    "source": "synthetic",
    "category": "Bukan Fiksyen",
    "language": "en",
    "title": "Animals Around Us",
    "author": "Peter Grant",
    "publisher": "Scholastic",
    "year": 2016,
    "pages": 28,
    "isbn": "9787000000148",
    "isbn_type": "synthetic",
    "rumusan": "Readers learn about common animals, their homes and basic habits.",
    "lesson": "Animals should be treated with care and respect.",
    "quality": "high",
    "created": "2026-07-01",
    "version": "1.0"
  },
  {
    "id": "syn-bf-en-000015",
    "source": "synthetic",
    "category": "Bukan Fiksyen",
    "language": "en",
    "title": "Saving Water at Home",
    "author": "Laura Hill",
    "publisher": "Oxford",
    "year": 2021,
    "pages": 20,
    "isbn": "9787000000155",
    "isbn_type": "synthetic",
    "rumusan": "The book gives easy ways to avoid wasting water at home.",
    "lesson": "Small daily actions can protect important natural resources.",
    "quality": "high",
    "created": "2026-07-01",
    "version": "1.0"
  },
  {
    "id": "syn-bf-en-000016",
    "source": "synthetic",
    "category": "Bukan Fiksyen",
    "language": "en",
    "title": "Healthy Food for Kids",
    "author": "Rachel Green",
    "publisher": "Ladybird",
    "year": 2023,
    "pages": 24,
    "isbn": "9787000000162",
    "isbn_type": "synthetic",
    "rumusan": "Children learn about fruits, vegetables, grains and balanced meals.",
    "lesson": "Healthy food gives energy for learning and playing.",
    "quality": "high",
    "created": "2026-07-01",
    "version": "1.0"
  }
]
