[
  {
    "id": "syn-fik-en-000009",
    "source": "synthetic",
    "category": "Fiksyen",
    "language": "en",
    "title": "The Helpful Bird",
    "author": "Emily Carter",
    "publisher": "Ladybird",
    "year": 2018,
    "pages": 24,
    "isbn": "978-700-000-009-4",
    "isbn_type": "synthetic",
    "rumusan": "A small bird helps lost animals find their way home before sunset.",
    "lesson": "Helping others can make a community safer and kinder.",
    "quality": "high",
    "created": "2026-07-01",
    "version": "1.0"
  },
  {
    "id": "syn-fik-en-000010",
    "source": "synthetic",
    "category": "Fiksyen",
    "language": "en",
    "title": "Mina and the Red Kite",
    "author": "Sarah Collins",
    "publisher": "Oxford",
    "year": 2020,
    "pages": 28,
    "isbn": "978-700-000-010-0",
    "isbn_type": "synthetic",
    "rumusan": "Mina fixes her kite with patience and shares it with her friends.",
    "lesson": "Patience and sharing can turn a problem into a happy day.",
    "quality": "high",
    "created": "2026-07-01",
    "version": "1.0"
  },
  {
    "id": "syn-fik-en-000011",
    "source": "synthetic",
    "category": "Fiksyen",
    "language": "en",
    "title": "The Little Raincoat",
    "author": "Anna Brooks",
    "publisher": "Scholastic",
    "year": 2017,
    "pages": 20,
    "isbn": "978-700-000-011-7",
    "isbn_type": "synthetic",
    "rumusan": "A child learns to be prepared when dark clouds appear before school.",
    "lesson": "Good preparation helps us face changes calmly.",
    "quality": "high",
    "created": "2026-07-01",
    "version": "1.0"
  },
  {
    "id": "syn-fik-en-000012",
    "source": "synthetic",
    "category": "Fiksyen",
    "language": "en",
    "title": "Tom's Garden Surprise",
    "author": "Michael Reed",
    "publisher": "Ladybird",
    "year": 2022,
    "pages": 32,
    "isbn": "978-700-000-012-4",
    "isbn_type": "synthetic",
    "rumusan": "Tom discovers that caring for plants takes time and responsibility.",
    "lesson": "Living things grow well when we care for them every day.",
    "quality": "high",
    "created": "2026-07-01",
    "version": "1.0"
  }
]
